	Column1	query	text_id	hit_id	left	hit	right	LABEL	AGENCY	DOMAIN	REAL_AGENCY	BENEFICIARY	letter_id	period	year_of_writing	authenticity	relation	author_name	author_gender	author_relation_to_recipient	author_year_of_birth	author_age	recip_name	recip_gender	recip_relation_to_addressee	recip_year_of_birth	recip_age	CORRESPONDENCE	DECADE	Kolom1	query_standardised
3889	26110	god	CHAMBER_067	CHAMBER_067.994_994	shall either return or tarrie at sea side . Some whispering here is that the comming of the ambassador is about a treatie or meeting at Brussells for the compounding of the busines of the Palatinat and all other differences now on foot in Christendome , which meeting shold have ben here but for favoring the Kings purse that he might have seene their reall proceeding : but yf the mariage be not perfected till that busines be ended ,	God	knowes when we may expect {REMOVE:check_text} th Prince , unles he grow impatient of so long delay . And the fleet may be redy all in goode time though yt shold stay a moneth or two longer . The earle of Rutland is declared admirall of yt , the Lord Windsor viceadmirall , and the Lord Morley reareadmirall , all of the same stampe . But let men thincke and talke what they will , the King knowes more	BODY	RESIGNATION	POLITICS	0	0	CHAMBER_067	E2	1623.0	AUTOGRAPH	FRIEND	JOHN_CHAMBERLAIN	MALE	FRIEND	1554	69	DUDLEY_CARLETON	MALE	FRIEND	1573	50	CHAMBER	1620	67.0	GOD
3965	28103	god	COSIN_013	COSIN_013.66_66	Good honest Mr. Cosen , I shall send you my answere , I hope , the next weeke unto my Informers , though composed tempore saevissimo . My little Mall hath ben desperately sicke ever since my returne from Windsore , and whether you shall ever see her more in this world or I enjoy her long I can not tell . I feare no .	God	must worke wonders if so . My joy , my greife ! Till that come I send you this , a part of my answere to Bulenger for Mr. Casaubon . If you like it and you can gett it printed do . It will $be a book it self , though it be not the half of what I have don . Commend me to Dr. Lindsell , though I thinke he hath forgotten me . Tell him	BODY	RESIGNATION	DISEASE	0	0	COSIN_013	E2	1624.0	UNKNOWN	OTHER	RICHARD_MOUNTAGUE	MALE	_	1577	47	JOHN_COSIN	MALE	_	1595	29	COSIN	1620	13.0	GOD
3996	26144	god	CHAMBER_070	CHAMBER_070.64_64	My very goode Lord : We had newes here yesterday that the Kings ship that was to bring over Count Mansfeld was cast away at Flushing , and all that were in her lost save himself and two pages escaped in his doublet and hose and is come in a pincke to Margat : this were a bad beginning yf yt be true .	God	send us better hereafter . The letters to the Lieutenants to presse men for his employment were signed with some difficultie the last weeke , but not yet put in practise : nor perhaps will not be in haste , yf the bruit be true that the French king is backward in the busines , which seemes somwhat straunge that they who have so long and by so many meanes sought to set us on , should now draw	BODY	PRAYER	TRANSPORT	GOD	OH	CHAMBER_070	E2	1624.0	AUTOGRAPH	FRIEND	JOHN_CHAMBERLAIN	MALE	FRIEND	1554	70	DUDLEY_CARLETON	MALE	FRIEND	1573	51	CHAMBER	1620	70.0	GOD
4017	79025	god	PASTON_449	PASTON.3910_3910	a tokyn to my lord Tresorere +tat he shuld excuse my lord of Oxenford to +te Quene , for as moche as ye hathe infeffid my lord of Oxenford in a trost in +te maner of Cotton he may no lesse doo but helpe yow , &c . Item , thys day is +te massenger gon to my lady of Suffolk wyth my lord letter . I shall have a answere at +te More on Monday , I trost to	God	, ryght god , &c . It cowd non ere be sped ; my lord hath be all +tis weke at +te $cowncell at Chelchythe , and j day at Chenne . Item , I send yow iij writtys for feleneys and trespace and ij for Mariote mater . Also your flowyr ; also a letter of Callys ; also a write for Playter ; a letter to Mastres Clere . Item , my lord wylle in any wyse	BODY	CONFIDENCE	COMMUNICATION	0	0	PASTON	M4	1469.0	COPY	FAMILY_NUCLEAR_CODE_METADATA	MARGARET_PASTON[N.MAUTBY]	FEMALE	MOTHER	_	_	JOHN_PASTON_II	MALE	SON	1442	27	PASTON	1460		GOD
4026	33222	god	HUTTON_079	HUTTON_079.40_40	Sir , I was muche comforted and refreshed with hope that , by your good meanes and your sonne 's , my brother should have had present delyverye from his long and tedious imprisonment : but I perceyve yt is	God	's will yet to trye me further how I can beare his hand ; for of late I receyved a letter from my nephew Matthew , wherein he desyred that with patience his jorney to London <P_316> for that occasion might be deferred till Candlemas terme , in respect both-2 of his owne weaknes and his wyf 's dangerous sicknes , whom to leave so soone in suche a case woulde be to her a great discomfort and discouragement	BODY	RESIGNATION	POLITICS	0	0	HUTTON_079	E2	1627.0	AUTOGRAPH	FAMILY_OTHER	TALBOT_BOWES	MALE	BROTHER_IN_LAW	_	_	TIMOTHY_HUTTON_I	MALE	BROTHER_IN_LAW	1569	58	HUTTON	1620	79.0	GOD
4043	85939	god	PLUMPTO_044	PLUMPTO_044.345_345	to convey the wryt , shold goe to the Schereffe of Notinghamshire agaynst you , unto the next terme ; then Gode send us good speede therwith . Afore Easter , send upp your pardons , wrytes of dedimus , and escaptes of instruccion what plee we shall make for you in the Excheker , of , and how , and wherby ye enter your lands and maketh clame ; the matter is litle , and ioyus , with <P_93>	Gods	grace , I purpose to be ever all this vacacion , and unto the next terme . I send to you a letter by Robert Beckwith , and more of every thing concerning you and your servants your atturney can shew . I wold , if I myght by wyshe , speak with you one houre , and yt pleased <font> Jesu </font> , who preserve your mastership in prosperous long to endure . Wrytten at London , the	BODY	DIVINE APPROVAL	TRADE	0	0	PLUMPTO_044	M4	1490.0	COPY	FAMILY_OTHER	EDWARD_PLUMPTON	MALE	KIN	_	_	ROBERT_PLUMPTON_I	MALE	KIN	1453	37	PLUMPTO	1490	44.0	GOD
4163	86517	god	RUTLAND_001	RUTLAND_001.44_44	Trusty and right welbeloved we grete you wele , ascertaynyng you that for the singulier trust that we have in your approved trouth and wisedome , we have appoincted you to be Comptroller of houshold with our derest son the Prince , entending by	Goddes	grace that he shal procede to the begynnyng of the same the vij. day of May next commyng . Wherfor we pray you that ye wil fully dispose you to take uppon you the said rowme and auctoritie , and to yeve your attendance in $the ordering and establisshing of the same , desiring you that somwhat bifor the said tyme ye wol addresse you unto us to thentent that uppon convercacion we may shewe unto you our minde	BODY	DIVINE APPROVAL	INTENTION	0	0	RUTLAND_001	M4	1492.0	COPY	OTHER	HENRY_TUDOR_VII	MALE	_	1457	35	HENRY_VERNON	MALE	_	1445?	47?	RUTLAND	1490	2.0	GOD
4217	35474	lord	ORIGIN1_007	ORIGIN1_007.195_195	the lord Daubeney our chamberlayn by land toward thoes parties , to arredie our subgiettes for the subduyng of hym , and our right trusty counseillour the lord Broke , steward of our household , by water with our armee on the See now late retourned , to take the said Perkyn if he retorne agayn to the See . And we shall in our owne persone , if the case soo requir , goo soe accompanyed thiderward with our	lordes	mercy withoute delay , as we shal subdue the said Perkyn and all othre that wil take his part if eny such be . And therfore we hertily pray you to addresse you unto us with six score talle men on horsback defensibly arrayed , and no moo , without eny long delay . And to mete with us at our manoir of Wodestok the xxiiij=th= day of this present Moneth ; and at your commyng unto us we	BODY	DIVINE APPROVAL	TRAVEL	0	0	ORIGIN1_007	M4	1497.0	COPY	OTHER	HENRY_TUDOR_VII	MALE	_	1457	40	GILBERT_TALBOT_1	MALE	_	1553	-56	ORIGIN1	1490	8.0	LORD
4297	26454	jhesu	CLIFFO_042	CLIFFO_042.140_140	by your writinges that if ye shuld have gone theder when ye were mocioned by my lord cardinall it shuld have put yow in jeoparde of your liff . And now madam for to go theder shuld not onely amonges al wisemen be reputid a gret lightnes in yow , pondering your excuse afor , but also a mervelous inconstancy that ye shuld mak so farr a progres so sone after the deth of my lord and fader whos soull	$Jhesu	{TEXT:Jhu} pardon . Writen at Ohelsan the xxjth day of August . Your humble lovyng son , Henre Northbreland . _OCTOBER_[1532].}	BODY	PRAYER	DEATH	GOD	OH	CLIFFO_042	E1	1527.0	AUTOGRAPH	FAMILY_NUCLEAR	HENRY_PERCY_III	MALE	SON	1502?	25?	CATHERINE_PERCY	FEMALE	MOTHER	_	_	CLIFFO	1520	43.0	JESUS
4321	85976	god	PLUMPTO_056	PLUMPTO_056.513_513	discret answere may be my making . For , and she and I fortune by God and your meanes togyther , our too goods and substance wyll make me able to doe you good service , the which good service and I , now and at all tymes , is and $shall $be Sir , I besech your good mastership to wryte to me an answere in all hast possible , and after that ye shall here more , with	Gods	grace , who preserve you and yours in prosperous felicyte longtyme to endure . Wrytten in Furnywall Inne in Olborn , the ij day of March 1496 . Your humble servant , Ed. Plompton . 	BODY	DIVINE APPROVAL	0	0	0	PLUMPTO_056	M4	1497.0	COPY	FAMILY_OTHER	EDWARD_PLUMPTON	MALE	KIN	_	_	ROBERT_PLUMPTON_I	MALE	KIN	1453	44	PLUMPTO	1490	57.0	GOD
4336	23910	god	BRERETO_006	BRERETO_006.237_237	nede , I $could $not {TEXT:colnott} haue tarreyd yn thys contreye , fore syche god as I hadd I lafte yn kypynge with the faulse pryest and hys broder , as Good knowyth , and your mastershypp be myn ynstruccion . I tryst that you wyll be gud master vnto me that I maye haue ryght of them , and what that I haue promyseyd vnto you afore thym by my letters , I schaull performe by the grace of	God	. Syr , I haue delivered to the sayd Roberth a qwittans fore the xl li before wrytten , wyche ys seylyd and subscrybyd wyt myn owne hond , and I pray you to take of hym a byll of my hand wryttyng wyche I mayd hym fore the peyment of the xl li , or yf he haue yt nott wyt hym , to take a qwyttans fore hyt so that I maye be dyschargytt fore the sayd	BODY	DIVINE APPROVAL	INTENTION	0	0	BRERETO_006	E1	1528.0	UNKNOWN	OTHER	EDWARD_SMYTTYNG	MALE	_	_	_	WILLIAM_BRERETON	MALE	_	1490?	38?	BRERETO	1520	7.0	GOD
4342	31658	god	HENRY8_001	HENRY8_001.88_88	yow that thys berer and hys felow be dyspecyd with as meny thynges to compasse oure mater and to bryng it to pas as oure wyttes colde inmagyn or device . Whyche browght to pas , as I trust by theyre dylygence it shall be schortly , yow and I shall have oure desyryd ende , whyche shulde bee more to my hartes ease and more quiettnes to my $mynd than any other thyng in thys worlde , as with	god	grace shortly I trust shal be provyd , but nott so soon Yet I wyll ensure yow , ther shal $be no tyme lost that may be wonne , $and forther $can $not {TEXT:cannott} be donne . For vltra $posse non est esse . Kepe hym nott to long with yow but desyre hym for your sake to make the more spede . For the sonner we shall have worde frome $hym , the sonner shall oure mater comme	BODY	DIVINE APPROVAL	X	0	0	HENRY8_001	E1	1528.0	AUTOGRAPH	FAMILY_NUCLEAR	HENRY_TUDOR_VIII	MALE	HUSBAND	1491	37	ANNE_BOLEYN	FEMALE	WIFE	1501?	27?	HENRY8	1520	2.0	GOD
4529	35177	god	MORE_025	MORE_025.45_45	Maystres Alyce , in my moste hartie wyse I recommende me to $you . And where as I am enformed by my sone Heron of the losse of our barns and our neighbours also with all the corne that was therin , albeit ( savyng	Goddis	pleasuer ) it wer greate pytie of so $myche good corne loste yet sythe it hathe lyked hym to sende vs suche a chaunce , we muste and ar bounden not onely to be content but also to be glade of his visitacion . He sent vs all that we haue loste and sythe he hathe by syche a chaunce taken yt away ageyne his pleasuer be fulfylled ; let vs never gruge therat but take in good worth	BODY	DIVINE APPROVAL	TRANSPORT	0	0	MORE_025	E1	1529.0	AUTOGRAPH	FAMILY_NUCLEAR	THOMAS_MORE	MALE	HUSBAND	1478	51	ALICE_MORE	FEMALE	WIFE	1471?	58?	MORE	1520	25.0	GOD
4545	26738	jhesu	CLIFFO_073	CLIFFO_073.37_37	$Jhesus Ryght honorabyll lord erell of Comberland , I Gorge Tomson sertyfyng yowr lordshep of a sarwand at was my lord $Perse called Rolland Qwarton wych is departed on Sent Marke day to Almyghty God whose sowlle	$Jhesu	cherch in Doncaster . Yowr lordshep sertyfyng my lord Perse of yowr letter that yowr lordshep hasse . Shewyng yowr lordshep that a blake horse with a whyte rake and a whyte tepe of the nose and a whyte saddell of bivfe lether with a blake harnes pertenyng to the sayme wych the proctor of Doncaster hasse resawed for hys mortuary called Master Worrall dwellyng in the parsoneg of Doncaster . I hafe bene with hym shewyng hym that	BODY	PRAYER	DEATH	GOD	OH	CLIFFO_073	E1	1526.0	AUTOGRAPH	OTHER	GEORGE_THOMPSON	MALE	_	_	_	HENRY_CLIFFORD_II	MALE	_	1493?	33?	CLIFFO	1520	73.0	JESUS
4624	28526	lord	CROMWEL_007	CROMWEL_007.38_38	Please it your grace to be aduertised that I haue receyued your letteres by Thomas Rawlyns and haue perceyued the contentes thereof and will make answer to the same particulerly by my seruaunt Rafe Sadleyr , who our	lorde	willing $shall $be {TEXT:shalbe} with your grace with all spede . Your grace I assure you is moche bounde to the gentilman this berer for his good reporte in euery place who I assure your grace hathe not lefte in euery presence to say of you as by lykelohod ye haue gyuen him cause . I assure your grace he and such other haue don your grace moche good , it $shall $be {TEXT:shalbe} in myn opynion therefore right	BODY	DIVINE APPROVAL	TRAVEL	0	0	CROMWEL_007	E1	1530.0	AUTOGRAPH	OTHER	THOMAS_CROMWELL	MALE	_	1485?	45?	THOMAS_WOLSEY	MALE	_	1473?	57?	CROMWEL	1530	8.0	LORD
4638	26834	god	CONWAY_014	CONWAY_014.592_592	him to exercise his skill which I wonder hath beene so long with so little successe . Dearest , for my advice it is so little in Physick that I dare not give it , though were it never so great I should tremble to pronounce it in order to your surcease of the best , which if ill would be the highest affliction ( God knows I speake truth ) could I thinke befall me . I shall pray	God	to blesse what meanes you use for your health , and desire you to shake of melancholy as much as possibly you <P_66> can : for though in men it be hurtfull to themselves and diseasefull to others yet in your sexe all those inconveniences are improved and what in a man is unliked in a Lady is intollerable . I speake now more like a Politick Monsieur then a Physitian , but in order so that Melancholy will	BODY	PRAYER	DISEASE	ADDRESSEE	ADDRESSEE	CONWAY_014	E3	1652.0	AUTOGRAPH	FAMILY_NUCLEAR	JOHN_FINCH	MALE	BROTHER	1626?	26?	ANNE_CONWAY[N.FINCH]	FEMALE	SISTER	1631	21	CONWAY	1650	14.0	GOD
4705	34840	god	LISLE_004	LISLE_004.487_487	tt my lorde / I can haue nonother pasage her but In the same nave that the pop saylles In the wheche ys x galles and viij grytt shepys and all marueles wyll a pyntyd that ar synde ffrom the ffransche Kynge to the pop / and I In tynde to tare In marsylles to a know mor nvys and than wethe all the spyd that maye be I wyll synde your lorde schep worde / by the gras of	god	ho Euer synde your lordeschyp and my good lade longe lyffe wethe moche aowner and at <P_I,564> the plesyr of god to synd your lordeschep by my good lade a son and ayre to make your good lordeschep and my good lade glad a myn By your sarvante and bydman John Cheryton my lorde / as ffor aowre holle ffader the pop he has ij the ffayryste wemyn to hys wyuys that Euer I sawe aowtt of Engelonde /	BODY	DIVINE APPROVAL	COMMUNICATION	0	0	LISLE_004	E1	1533.0	AUTOGRAPH	FAMILY_SERVANT	JOHN_CHERITON	MALE	FAMILY_SERVANT	_	_	ARTHUR_PLANTAGENET	MALE	_	_	_	LISLE	1530	4.0	GOD
4739	21389	god	BARRING_020	BARRING_020.271_271	) shall carie toward you . What I shall now expresse to your ladiship hath long lyen like fire in my bones , Jeremiah , . I said I would not make mention of his name in this kind to you , but his word was in my heart as a burning fire , shut up in my bones and I was weary with forbearing and I could not stay . Good madame , it is not for nothing the	God	of heaven hath sent such thunderclaps of late and made such great offers at the dore of your ladiship 's heart . Distractions about children and their afflictions , deprivall of a deare and tender yoake fellow , weakenesses in the outward and troubles in the inward man , what are they but loud alarums to awaken you ? The father of lights be pleased himselfe to shew you the interpretation of these dreames . Certainely ( madame )	BODY	RESIGNATION	RELIGION	0	0	BARRING_020	E2	1629.0	AUTOGRAPH	OTHER	ROGER_WILLIAMS	MALE	_	1604?	25?	JOAN_BARRINGTON	FEMALE	_	1558?	71?	BARRING	1620	20.0	GOD
4795	26995	god	CONWAY_047	CONWAY_047.507_507	hear nothing yet of Alderman Nowell , if he be still at London you will have a good oppertunity of sending Des Cartes Letters if you give him directions to deliver the book to Con , whom my brother John intends to returne to me so soone as he leaves England , which will be the beginning of the next month . I have my health much at the same passe as my former letters made mention . I pray	God	send me good newes of yours , for I can assure you there is nothing more earnestly desir'd , then your health and happinesse , by Your ever most entirely affectionate friend and servant , A. Conway . 	BODY	PRAYER	HEALTH	OH INDIRECT	WRITER	CONWAY_047	E3	1662.0	AUTOGRAPH	FRIEND	ANNE_CONWAY[N.FINCH]	FEMALE	FRIEND	1631	31	HENRY_MORE	MALE	FRIEND	1614	48	CONWAY	1660	48.0	GOD
4809	21410	lord	BARRING_020	BARRING_020.1034_1034	, only I beseech you lay to heart these few considerations . 1. First : Job , 34.9. He with whome we deale excepteth not the persons of princes nor regardeth the rich more than the poore ; for they are all the worck of his hands . 2. Where birth great , maintenance more ample , time longer , and meanes of grace more plentifull , there a great account is of the lord expected . Luc. 12.3. The	lord	will doe what he will with his owne . He owes you no <P_68> mercy . Exodus , 33.19. I will be gracious to whome I will be gracious {to}_P , and will shew mercy to whome {to}_P I will shew mercy . 4. Call to mind what a cut , what a gnawing worme it will be ( the lord , the lord forbid it ) if ever you cast up your eye toward heaven and see so	BODY	RESIGNATION	RELIGION	0	0	BARRING_020	E2	1629.0	AUTOGRAPH	OTHER	ROGER_WILLIAMS	MALE	_	1604?	25?	JOAN_BARRINGTON	FEMALE	_	1558?	71?	BARRING	1620	20.0	LORD
4814	21415	lord	BARRING_020	BARRING_020.1170_1170	it will be ( the lord , the lord forbid it ) if ever you cast up your eye toward heaven and see so many blessed branches in the bosome of Christ , and your stock rejected . 5. Slight not I beseech you all these late loud alarums and sharpe files with which the lord hath striven to burnish you . Ezeckiel , 24.13.6. Remember I beseech you , your candle is twinckling and glasse neere runn . The	lord	only knowes how few minutes are left behind , Psalm Fortie yeares was I greeved , then I swore in my wrath they should never enter into my rest . No heart but a trembling heart can get assurance the lord hath not sworne . To that heart he hath sworne to be gracious . In that petition my soule followes hard after him , and still will I wrastle untill you say a blessing is come , a	BODY	RESIGNATION	RELIGION	0	0	BARRING_020	E2	1629.0	AUTOGRAPH	OTHER	ROGER_WILLIAMS	MALE	_	1604?	25?	JOAN_BARRINGTON	FEMALE	_	1558?	71?	BARRING	1620	20.0	LORD
4967	27173	god	CONWAY_092	CONWAY_092.57_57	Madam ! Not to spend much time in professions how welcome your letter is to me , ( though I can profes no more then is true in that point , it being a messenger to me of that wch I am heartily glad of , viz of your recovery of your health , wch I pray	God	continue to you , and of your persistency in your noble designe upon Philosophy , wch I begin to think you are likely to continue in . ) I will forthwith fall upon the matters your Ladiship has propounded to me , by way of objections . The first whereof is upon the 18 Paragr. of the 2 Part of Des Cartes his Principles , where he contendes that an empty space emplyes a contradiction . And here you	BODY	PRAYER	DISEASE	GOD	ADDRESSEE	CONWAY_092	E3	1651.0	AUTOGRAPH	FRIEND	HENRY_MORE	MALE	FRIEND	1614	37	ANNE_CONWAY[N.FINCH]	FEMALE	FRIEND	1631	20	CONWAY	1650	92.0	GOD
4981	35193	almighty	MORE_027	MORE_027.595_595	that it was made by hys honorable Counsail , and by them put in print with his Graces licens obteined therunto , I verely trust in good faith that of your good mind toward me , though I neuer wrote you worde thereof , your selfe will both think and say so much for me , that it were a thing far vnlikely , that an answer shold be made therunto bi me . I wil by the grace of	Almighty	God , as long as it shal plese him to lend me life in this worlde , in all such places ( as I am of my duety to God and the Kinges Grace bounden ) truly say my mind , and discharge my conscience , as becometh a pore honest true man , whersoeuer I $shall $be {TEXT:shalbe} by his Grace commaunded . Yet suerly if it shold happen any boke to come abrode in the name of	BODY	DIVINE APPROVAL	INTENTION	0	0	MORE_027	E1	1534.0	COPY	OTHER	THOMAS_MORE	MALE	_	1478	56	THOMAS_CROMWELL	MALE	_	1485?	49?	MORE	1530	27.0	ALMIGHTY
4995	27202	god	CONWAY_098	CONWAY_098.66_66	 For the Right honourable Edward Lord Viscount Conway these .  My Lord Your Lordships letter exhibits to my view the representation of many sad Tragedies , though I finde my self so nearly concerned in none as that wch respects your noble and virtuous Lady , her body as you say empairing every day and her fitte remissions growing still more intolerable I pray	God	enable your Lordship to <P_536> send better newes . That you firmly believe divine Providence , though your reason be puzzled at some occurrences in the world , you do very well and piously , I add rationally too , respecting y=t= Reason wch your Lordships self has intimated , that the wisedome of God is infinitely more comprehensive than ours , and therefore it is reasonable , y=t= some things should come to passe , y=t= is contrary	BODY	PRAYER	DISEASE	OH DIRECT	WRITER AND ADDRESSEE	CONWAY_098	E3		AUTOGRAPH	OTHER	HENRY_MORE	MALE	_	1614	44?	EDWARD_CONWAY_JR	MALE	_	1623	35?	CONWAY	0	98.0	GOD
5095	27302	lord	CORNWAL_004	CORNWAL_004.1361_1361	to you and troublesome to myselfe , I eaven humbly beseeche Sir N. Bacon and your La. with impartial counsellors , to consider of this weighty affair , and not to lett slip so fayre an occasion of glory to God , good to the contry , preferment to your sonne , and comfort to yourselves . I would to God it might enter into your mynde to make some worthy additions to your former proffers . I beseche the	Lord	Jesus of his eternal Spirit to directe you in the managing of this matter to the accomplishing of it , if it be His <P_9> good pleasure . And thus , praying God for the continual encrease of your temporal and spiritual prosperity , I present the remembrance of my humble duty to Sir N. Bacon and your Ladyship , and rest , Your Ladyshypps to be commanded in what {in}_P I may , Elnathan Parr . M=r= Parr	BODY	PRAYER	POLITICS	ADDRESSEE	ADDRESSEE	CORNWAL_004	E2	1613.0	UNKNOWN	OTHER	ELNATHAN_PARR	MALE	_	_	_	ANNE_BACON[N.BUTTS]	FEMALE	_	_	_	CORNWAL	1610	4.0	LORD
5111	21435	lord	BARRING_023	BARRING_023.379_379	madame , goe on with courage and resolution ; fixe one ey upon your self , that your soule may ever be sensible of your need of the mercyes of God and merites of the lord Jesus ; fasten an other eye upon the unsearchable mercyes of God and the infinit merites of the lord Jesus ; in your self be nothing , that Christ may be all in all with you and for you ; keepe close unto the	lord	, let him be the alpha and omega the begining and endeing of every day unto you , behould him ever behoulding you , make his word your rule and his spirit your guide : so shall your course be right and your conclusion sweete : be humble for infermityes and frayltyes , but not too much dejected where the heart is upright : improve all meanes for a spirituall growth , it was a sweete and great commendation	BODY	RESIGNATION	RELIGION	0	0	BARRING_023	E2	1629.0	AUTOGRAPH	OTHER	JAMES_HARRISON	MALE	_	_	_	JOAN_BARRINGTON	FEMALE	_	1558?	71?	BARRING	1620	23.0	LORD
5112	27319	god	CORNWAL_011	CORNWAL_011.149_149	performe . If it be accepted , we shall rejoyse much therein ; if not , we must be contented without grudging , asseuring ourselves it is the Lord 's doing . And although the juell layd before us be never so riche , if we be not abill to buy it we must be content to forbeare it . We must not laye out all our stocke upon one purchas , having so many others to provide for .	God	blesse the good La. with a richer choyse , that may bringe a happy content to hyr mind . I do honor and love hyr with my holle hart , and I know an honester and trew harted husband shall she never have . But this I leave unto hyr La. <P_16> consideracion ; resting much indebted unto you for your kinde and faythfull love , which you shall finde as occasion dothe serve . Yo=rs= asseuredly , Anne	BODY	PRAYER	TRADE	OH INDIRECT	OH	CORNWAL_011	E2	1613.0	COPY	OTHER	ANNE_BACON[N.BUTTS]	FEMALE	MOTHER_IN_LAW	_	_?	JANE/BACON[N.MEAUTYS]	FEMALE	DAUGHTER_IN_LAW	1581		CORNWAL	1610	11.0	GOD
