	Column1	query	text_id	hit_id	left	hit	right	LABEL	AGENCY	DOMAIN	REAL_AGENCY	BENEFICIARY	letter_id	period	year_of_writing	authenticity	relation	author_name	author_gender	author_relation_to_recipient	author_year_of_birth	author_age	recip_name	recip_gender	recip_relation_to_addressee	recip_year_of_birth	recip_age	CORRESPONDENCE	DECADE	Kolom1	query_standardised
9218	31858	god	HOLLES_030	HOLLES_030.57_57	To the Duke of Lennox , Lord Stuard , from the fleet , of December 1615 My good Lord this is only to remember , and present my service to your Lordship which I hope yow will accept , though it cum from a prisoner , and oute of a prison : for we pray hence to	God	Allmighty allso , and he receaves our prayers , be the offendor never so foule that makes them : and though the depravednes of mans nature punnish all misdoing alike espetially wher the person is offensive , yet I beseech your Lordship measure not the magnitude of my demerits , by the magnitude of my punishment , for then should be in faultiness , next those termed the poisoners , and a delinquent in the hyest degree of misdemeanour	BODY	PRAYER	POLITICS	WRITER AND OH	WRITER AND OH	HOLLES_030	E2	1615.0	COPY	OTHER	JOHN_HOLLES_SR	MALE	_	1565?	50?	LUDOVICK_STUART	MALE	_	1574	41	HOLLES	1610	30.0	GOD
9224	31864	god	HOLLES_031	HOLLES_031.348_348	to yow my condition , which seems in vulgar eys muche worse , because heer I am left to the gleanors , to pay the ransum of the indiscretion , others never questioned , freed , or enlarged . But I must , and can attend the Kings leasure , or the turne of the tyde : yet neglect I not ordinary means , having layd downe my desires before his Majesty who solus Achilleo tollere more potest , which	God	grant ; howsoever I have done my part . This most noble Lord in his joint love to us bothe , hath voutsafed to be the bearer of this , and it is a great happines to me , to have him a wittnes of your love , and my thankfullnes , for more then a thankfull hart I can not retribute , which though the poorest may , yet if the greatest do not , what is done	BODY	PRAYER	POLITICS	OH DIRECT	WRITER	HOLLES_031	E2	1615.0	COPY	OTHER	JOHN_HOLLES_SR	MALE	_	1565?	50?	FRANCIS_BACON	MALE	_	1587?	28?	HOLLES	1610	31.0	GOD
9356	32004	god	HOLLES_059	HOLLES_059.297_297	, whom he conceaved least in quarter with me , and <P_II,203> preferred a petition to the King against me , uppon which beeing questioned by his Committies , my answere was so satisfactorie , as they gave it over , then he brings me into Chancerie , and mooves the King by his mean , to further the cause with the Keeper to a hearing , which galloped after that manner as never cause did , and I pray	God	the president may dy with it , for from the putting in the bill to the hearing , and decree was not 3 weeks , and all this allso in the vacation , wheras all other causes have their beginning , and ending in terms , and the greatest expedition in this Court is 2 or 3 years . Notwithstanding this extraordinarie favour , and that the keeper fynding little good for him judicially , personating the arbitrator ,	BODY	PRAYER	POLITICS	GOD	OH	HOLLES_059	E2	1617.0	COPY	FAMILY_NUCLEAR	JOHN_HOLLES_SR	MALE	BROTHER	1565?	52?	THOMAS_HOLLES	MALE	BROTHER	_	_	HOLLES	1610	60.0	GOD
9366	88445	god	WENTWOR_023	WENTWOR_023.105_105	to send this bearer towards your Lordship that soe by the tender of my duty and seruice , I might receaue at the least , the welcome newes of your good health , which I shall take as a fauourable aspecte on my journey ward ; as also to offer my selfe a minister of your comaunds , <P_109> if my good fortune bee such , as I may bee usefull unto your Lordship at London . I sett forward	$God	$willinge {TEXT:Godwillinge} , Munday next , in the meane space I will waite for the honore of your imployments . I wish my Lord Clifford a safe retorne home to your Lordship with good successe in all which hee goes about . To conclude all in a word , I pray for your Lordship 's longe life and happines , and in soe doinge I remaine firmly and observantly Your Lordships most obedient sonne in law to bee comaunded	BODY	DIVINE APPROVAL	TRAVEL	0	0	WENTWOR_023	E2	1618.0	COPY	FAMILY_OTHER	THOMAS_WENTWORTH	MALE	SON_IN_LAW	1593	25	FRANCIS_CLIFFORD	MALE	FATHER_IN_LAW	1559	59	WENTWOR	1610	23.0	GOD
9418	88446	god	WENTWOR_023	WENTWOR_023.107_107	this bearer towards your Lordship that soe by the tender of my duty and seruice , I might receaue at the least , the welcome newes of your good health , which I shall take as a fauourable aspecte on my journey ward ; as also to offer my selfe a minister of your comaunds , <P_109> if my good fortune bee such , as I may bee usefull unto your Lordship at London . I sett forward $God $willinge	{TEXT:Godwillinge}	, Munday next , in the meane space I will waite for the honore of your imployments . I wish my Lord Clifford a safe retorne home to your Lordship with good successe in all which hee goes about . To conclude all in a word , I pray for your Lordship 's longe life and happines , and in soe doinge I remaine firmly and observantly Your Lordships most obedient sonne in law to bee comaunded , Th.	BODY	DIVINE APPROVAL	TRAVEL	0	0	WENTWOR_023	E2	1618.0	COPY	FAMILY_OTHER	THOMAS_WENTWORTH	MALE	SON_IN_LAW	1593	25	FRANCIS_CLIFFORD	MALE	FATHER_IN_LAW	1559	59	WENTWOR	1610	23.0	GOD
9457	88495	god	WENTWOR_030	WENTWOR_030.192_192	, there would bee as speedy a conclusion made , as possibly may bee without apparant precipitacon , or els very great disaduantage . I conceaue your affaires in those cuntryes , will detaine yow there soe longe , as I $shall $be {TEXT:shalbee} at London a weeke or ten dayes before yow ; if your Lordship please to imploy mee in any seruices , yow may comaund him , that most readily undergoes them . I set forward ,	$God	$willinge {TEXT:Godwillinge} , Munday cum fortnight . My Lord , I must still make bold to entreat your Lordship that Thomas Pickering may search upp for an indenture betwixt my Lord your grandfather and Dakins and Pollard <P_123> touchinge the rent charge out of Pickering lithe , that soe I may either haue the originall , or at least a coppy therof . Lastly prayinge that your hopes may still bee confirmed , both-1 to your owne greatest comforte	BODY	DIVINE APPROVAL	TRAVEL	0	0	WENTWOR_030	E2	1619.0	COPY	FAMILY_OTHER	THOMAS_WENTWORTH	MALE	BROTHER_IN_LAW	1593	26	HENRY_CLIFFORD_IV	MALE	BROTHER_IN_LAW	1591	28	WENTWOR	1610	30.0	GOD
9505	88496	god	WENTWOR_030	WENTWOR_030.194_194	would bee as speedy a conclusion made , as possibly may bee without apparant precipitacon , or els very great disaduantage . I conceaue your affaires in those cuntryes , will detaine yow there soe longe , as I $shall $be {TEXT:shalbee} at London a weeke or ten dayes before yow ; if your Lordship please to imploy mee in any seruices , yow may comaund him , that most readily undergoes them . I set forward , $God $willinge	{TEXT:Godwillinge}	, Munday cum fortnight . My Lord , I must still make bold to entreat your Lordship that Thomas Pickering may search upp for an indenture betwixt my Lord your grandfather and Dakins and Pollard <P_123> touchinge the rent charge out of Pickering lithe , that soe I may either haue the originall , or at least a coppy therof . Lastly prayinge that your hopes may still bee confirmed , both-1 to your owne greatest comforte and the	BODY	DIVINE APPROVAL	TRAVEL	0	0	WENTWOR_030	E2	1619.0	COPY	FAMILY_OTHER	THOMAS_WENTWORTH	MALE	BROTHER_IN_LAW	1593	26	HENRY_CLIFFORD_IV	MALE	BROTHER_IN_LAW	1591	28	WENTWOR	1610	30.0	GOD
9532	32187	god	HOLLES_094	HOLLES_094.402_402	, he hath had the boys sute to make every since it came up , which I gladly would have sent you by the carrier , and he sends me word it will not be done till the next week . Jack tells me he will send for horses to bring him down , for my Lord Vere goes over within this fortnett , but my Lady , and my daughter stay till the great belly be discharged , which	God	grant may be to our cumforts . Jhon Coswarth hath brought his wyfe to this town , and cums to yow into the <P_II,351> cuntry , he asked me leave to keepe his footman , which I granted him . My caws for Elseley is heard the 5 June , which past , heer I stay not . My Lady Vere and my daughter stay till shee be brought to bed , my Lord Vere goes over within this	BODY	PRAYER	SOCIAL	GOD	WRITER AND OH	HOLLES_094	E2	1627.0	COPY	FAMILY_NUCLEAR	JOHN_HOLLES_SR	MALE	HUSBAND	1565?	62?	ANN_HOLLES[N.STANHOPE]	FEMALE	WIFE	1576	51	HOLLES	1620	94.0	GOD
9553	27395	god	CORNWAL_047	CORNWAL_045.1158_1158	... compacion then furder malles , to set roges to intytell them selves myne . _@ LETTER:CORNWAL_047:E2:1620:AUTOGRAPH:FAMILY_OTHER Syster , I here my brother hath nether coch nor horses , and , as I am told , is abought a matter of moment for hymself , w=ch= maketh me staye my desyne of hys being ther ; _@ LETTER:CORNWAL_047:E2:1620:AUTOGRAPH:FAMILY_OTHER and for sume other resons ... cosen Thomas Cornwaleys shall denygh mee , _@ LETTER:CORNWAL_047:E2:1620:AUTOGRAPH:FAMILY_OTHER or els ... shall be ther by	God	's suffrens . _@ LETTER:CORNWAL_047:E2:1620:AUTOGRAPH:FAMILY_OTHER If any frynds els ... stepe in to helpe to get such a knave punneshed , wherin my innosensy shall appeer to the woorld , I shall have cause to thynk my self beholdyng to them , _@ LETTER:CORNWAL_047:E2:1620:AUTOGRAPH:FAMILY_OTHER and I hope God will reward theme . _@ LETTER:CORNWAL_047:E2:1620:AUTOGRAPH:FAMILY_OTHER It is enough for a Crystyon ... saye that I desyre never too see the face of God if ther bee any chyld of myn	BODY	DIVINE APPROVAL	TRAVEL	0	0	CORNWAL_045	E2	1620.0	AUTOGRAPH	FRIEND	MARY_BOURCHIER	FEMALE	SISTER_IN_LAW	_	_	JANE/BACON[N.MEAUTYS]	FEMALE	SISTER_IN_LAW	1581	39	CORNWAL	1620	45.0	GOD
9566	88528	god	WENTWOR_038	WENTWOR_038.120_120	belonging the Sessions , I opened the same . But after I saw the contentes , I found my errour , being much more fitt both-1 in respect of your quallety , as also of your experience and wisdome in these seruices , that the lettere should haue beene first deliuered and opened by your Lordship . I haue therfore sent the same ( togeather with this excuse ) unto your Lordship by this bearer and will to morrowe ,	$God	$willinge {TEXT:Godwillinge} , my selfe attend yow , to know your further pleasure what course wee are to hold in the execucon of this seruice . In the meane space I shall cease further to trouble yow , and rest in the due and constant obseruance of beinge , your Lordship 's affecconate kinsman and seruant , Th. Wentworth . 	BODY	DIVINE APPROVAL	COMMUNICATION	0	0	WENTWOR_038	E2	1620.0	COPY	FAMILY_OTHER	THOMAS_WENTWORTH	MALE	COUSIN	1593	27	JOHN_DARCY	MALE	COUSIN	1588	32	WENTWOR	1620	38.0	GOD
9598	88529	god	WENTWOR_038	WENTWOR_038.122_122	Sessions , I opened the same . But after I saw the contentes , I found my errour , being much more fitt both-1 in respect of your quallety , as also of your experience and wisdome in these seruices , that the lettere should haue beene first deliuered and opened by your Lordship . I haue therfore sent the same ( togeather with this excuse ) unto your Lordship by this bearer and will to morrowe , $God $willinge	{TEXT:Godwillinge}	, my selfe attend yow , to know your further pleasure what course wee are to hold in the execucon of this seruice . In the meane space I shall cease further to trouble yow , and rest in the due and constant obseruance of beinge , your Lordship 's affecconate kinsman and seruant , Th. Wentworth . 	BODY	DIVINE APPROVAL	TRAVEL	0	0	WENTWOR_038	E2	1620.0	COPY	FAMILY_OTHER	THOMAS_WENTWORTH	MALE	COUSIN	1593	27	JOHN_DARCY	MALE	COUSIN	1588	32	WENTWOR	1620	38.0	GOD
9634	32014	god	HOLLES_062	HOLLES_062.271_271	payd to Mr Molineux 38=li= and receaved by Boote : in the whole the summ payd is : remaining of this account ( besyds the capons dew at our Lady day last ) is 72-13-6 : but first lett Mr Osburn take his reckning , and see how he agrees with this , which the rentalls proove trew . I would have yow receave the rent dew this day at Newark , and looke into those things : uppon thursday	God	{ED:?willing}_VAG I will send , have <P_II,250> therfore the rents reddy , for the next week I am gone to London , wherfore use all care heerin , and be with me uppon sunday : and so fare yow well : Haughton this 23 of October . J. Haughton . Person there is no reason the widdow should fence in the whole ground , but so handle it that is my will , that the next neabour , who	BODY	DIVINE APPROVAL	TRAVEL	0	0	HOLLES_062	E2	1621.0	COPY	FAMILY_SERVANT	JOHN_HOLLES_SR	MALE	_	1565?	56?	FRANCIS_PIERSON	MALE	FAMILY_SERVANT	_	_	HOLLES	1620	63.0	GOD
9680	32422	god	HOLLES_128	HOLLES.391_391	referr it to her owne direction , the which I suppose yow shall receave from her : I sayd your sorrowfull mother , and so shee is , and in that measure , as these three days shee hath not eaten one bitt of bread , and muche a doe have I with her , to gett down one spoonfull of brothe : meane while my part is hard to brydle so myn owne griefe as to disswade hers :	God	grant us all patience , for this morcell is ( marah ) even bitternes it self . God bless yow and my daughter your wife , and grant us all his grace to conform our wills to his . Amen . Nottingham this of October 1631 . Your very loving father Clare . Yow shall fynd a pyr of black stockins in the standart where the black clothe sutes be , which standart stands at the upper end of	BODY	PRAYER	SOCIAL	WRITER	WRITER	HOLLES	E2	1629.0	COPY	FAMILY_NUCLEAR_CODE_METADATA	JOHN_HOLLES_SR	MALE	FATHER	1565?	64?	JOHN_HOLLES_JR	MALE	SON	1595	34	HOLLES	1620		GOD
9690	32462	god	HOLLES_131	HOLLES.410_410	me to make known my tytle , which long I have neglected in my youth , besyds the carelessnes of that season , beeing many years abrode in the forreyn occasions of that time , both-5 by sea and land , and since , to confess a truthe , I merely forgott it : for my part I covet only my right and no more , and if any thing appear under my hand more then I have sayd ,	God	defend I should quarrell suche right . I shall be glad to hear of the good health and wellfare of my grandchildren , whom the Lord of heaven bless to all our cumforts , to whose holy protection I leave yow : from Westminster the 16 of May 1634 . Your Lordships . I have deputed one Mr Fernley of Dublin to sollicite this cause , whom I have appointed to attend your Lordship therabouts . To my very	BODY	PRAYER	SOCIAL	WRITER	WRITER	HOLLES	E2	1629.0	COPY	FAMILY_NUCLEAR_CODE_METADATA	JOHN_HOLLES_SR	MALE	FATHER	1565?	64?	JOHN_HOLLES_JR	MALE	SON	1595	34	HOLLES	1620		GOD
9696	32486	god	HOLLES_132	HOLLES.563_563	your Lordship therabouts . To my very loving sunn the Lord Haughton Jack , the Lord of heaven bless yow , and send yow well home out of that unsafe town , and yet this cuntry is little safer , Melton having infected many villages in this cuntry , and if Nottingam stand sound , it is a miracle ; 2 houses be shutt up in Nottingam , yet my Cosen Hutchenson writes to me there is no danger ,	God	grant it proove so at the full and change . And at Bothumsall a chyld dyed in the beginning of this week , the suspition is , that one of Melton a ioyner , was lodged at Pawmers , this day I heard of it from my Lord Kingston , who came hither : for surety sake I have caused the house to be shutt up , and the boddy to be viewed : the Lord of heaven be	BODY	PRAYER	POLITICS	GOD	OH	HOLLES	E2	1629.0	COPY	FAMILY_NUCLEAR_CODE_METADATA	JOHN_HOLLES_SR	MALE	FATHER	1565?	64?	JOHN_HOLLES_JR	MALE	SON	1595	34	HOLLES	1620		GOD
9758	30878	god	HARLEY_061	HARLEY_061.171_171	meete my desires in desireing , in some measure as I doo , to see me ; and if pleased the Lord , I wisch you weare at Brompton . I am now againe threatned ; there are some souldiers come to Lemster and 3 troopes of hors to Heariford with S=r= William Vauasor , and they say they meane to viset Brompton againe ; but I hope the Lord will deleuer me . My trust is only in my	God	, whoo neuer yet failled me . I pray you aske M=r= Kinge what I prayed him to tell you conserning Wigmore . I haue taken a very greate coold , which has made me very ill thees 2 or 3 days , but I hope the Lord will be mercifull to me , in giuing me my health , for it is an ill time to be sike in . My deare Ned , I pray God blles	BODY	RESIGNATION	POLITICS	0	0	HARLEY_061	E3	1643.0	AUTOGRAPH	FAMILY_NUCLEAR	BRILLIANA_HARLEY[N.CONWAY]	FEMALE	MOTHER	1600?	43?	EDWARD_HARLEY	MALE	SON	1624	19	HARLEY	1640	61.0	GOD
9775	88537	god	WENTWOR_040	WENTWOR_040.500_500	soe much under the vallewe . And on the other side , that it behoues mee to sell it in such conuenient tyme , as the moneies maie come in seasonably to discharge the debtes which I am engaged in my creditt to paie , a course too indeed ( as I judge ) most for your profitt and honore . And therfore if I heare not from your Ladyship before that time , I resolue to conclude the bargaine	$God	$willinge {TEXT:Godwillinge} upon such tearmes as I haue acquainted Mr Ogle with . There remaines nothinge but to present my wiue 's seruice to your Ladyship and my <P_148> Lady Ogle , togeather with my sister 's and my owne . Which done , I comitt your increase of sound health , and happinesse to the good grace and blessinge of the allmightie . Your Ladyships affecconate kinsman and deuoted seruant , Th. Wentworth . 	BODY	DIVINE APPROVAL	0	0	0	WENTWOR_040	E2	1621.0	COPY	FAMILY_OTHER	THOMAS_WENTWORTH	MALE	KIN	1593	28	JOAN_TALBOT	FEMALE	KIN	_	_	WENTWOR	1620	40.0	GOD
9791	32682	god	HOSKYNS_004	HOSKYNS_004.612_612	them this term & skatter the rest as I can single them within a yeare or 2 and then I hope to live merrylie with my 2 Bens & provide for y=r= 2 girles . I will bringe down every penny that remaynes above the forsaid debts discharged that must of necessity be discharged heere in London . my deare lovinge kynd earnest resolute weake mighty desperat tender harted brave miserable dayntie bountyfull carefull cruell godly sweet honest Ben :	god	keepe y=u= & your daughters & y=r= little boy whom I pray y~ doe not breed a clown . Send word whether I shall bring John Boorne down w=th= me . pray god I may finish this bargain for yet it is but a spech write to me where y~ will keepe y=r= Christmas & what small provision I shall heere make for it & as y~ will it shall be . God keepe y~ sweet deere hart .	BODY	PRAYER	SOCIAL	GOD	ADDRESSEE AND OH	HOSKYNS_004	E2	1611.0	AUTOGRAPH	FAMILY_NUCLEAR	JOHN_HOSKYNS_I	MALE	HUSBAND	1566	45	BENEDICTA_HOSKYNS[N.MOYLE]	FEMALE	WIFE	1575?	36?	HOSKYNS	1610	4.0	GOD
9795	32686	god	HOSKYNS_005	HOSKYNS_005.118_118	, ease , or lyfe it selfe , in extremyty of sicknesse as I doe that I might see y=u= before y=u= lye in . notw=th=standinge yf that may not be , yet I pray w=th= assurance of fayth to obtayne , & fynd comfort when I pray , that y=u= & y=r= chyld both may live & haue health , & ioy in the companie of this poore prisoner that now wrytes to y=u= . I haue intelligence (	god	grau~t it be true ) that there is a purpose to deliver vs vpon som vnexpected day neere the end of the terme . Whatever becom of me it shall nothinge greeue me yf y=u= retayn a comfortable spirit , & vndiscouraged hart in Christ Jesus . I haue endured a triall I am out of feare of my offences , I feare nothinge now , but only pray that god & his maiesty would testyfy theyr reco~ciliatio~ to	BODY	PRAYER	POLITICS	GOD	WRITER	HOSKYNS_005	E2	1614.0	AUTOGRAPH	FAMILY_NUCLEAR	JOHN_HOSKYNS_I	MALE	HUSBAND	1566	48	BENEDICTA_HOSKYNS[N.MOYLE]	FEMALE	WIFE	1575?	39?	HOSKYNS	1610	5.0	GOD
9801	32692	god	HOSKYNS_006	HOSKYNS_006.697_697	when did I deal ungratefully w=th= thee ? you must com Ben & refute them . In meane while take home y=r= Doctor the late rare example of suictors now made a greate kinge of beggars , a Mr. of an hospitall , & take my first servaunt Mr. Pateshall , delivered fro~ Wilsheere assises , restored to his office see that he be not ungratefull nor run~e not over us w=th= his witt . Forgive me Ben , &	God	forgive me for this idle letter & yf whereas I have somtymes wept & prayd , I somtymes laugh & pray hereafter . howsoever I will ever pray will remayn malitiouse to none infinitely & eternally loving to y=u= . God ever preserve y=u= John , Francke , Besse , Ben , dic & all yr family thyne only thyne all thyne ever J. Hoskyns . 2: March 1614 . 	BODY	PRAYER	SOCIAL	OH DIRECT	WRITER	HOSKYNS_006	E2	1615.0	AUTOGRAPH	FAMILY_NUCLEAR	JOHN_HOSKYNS_I	MALE	HUSBAND	1566	49	BENEDICTA_HOSKYNS[N.MOYLE]	FEMALE	WIFE	1575?	40?	HOSKYNS	1610	6.0	GOD
9843	33796	god	KNYVETT_035	KNYVETT_035.941_941	malignants . By the next Post the westerne busines $will $be {TEXT:wilbe} cleerer . London 'hath a very hot report of the Queens death , occasioned by some mischance that befell her in her sedan in the streets in Oxford , by the car'lessnes of her Porters . If this be true , suer God hath some great worke in it , & we shall see some suddaine alteration . I hope the Popish' party will really lessen apace .	Gods	$wil $be {TEXT:wilbe} done , And in his good time deliver vs out of these troubles . The same good God Bless thee & thine & send vs a happy meeting againe . My love to all my loving freinds , farewell . Thy deerest freind to love thee A. T. K. T. Apr: 3. 1644 . I thanke m=is= Rogery for her letter . I shall thinke of som'thing to say to her the next . $Ther $'s	BODY	RESIGNATION	POLITICS	0	0	KNYVETT_035	E3	1644.0	AUTOGRAPH	FAMILY_NUCLEAR	THOMAS_KNYVETT	MALE	HUSBAND	1596	48	KATHERINE_KNYVETT	FEMALE	WIFE	_	_	KNYVETT	1640	35.0	GOD
9875	32768	god	HOSKYNS_022	HOSKYNS_022.126_126	proceede to goe thither . I thincke I shall troble y=r= patience w=th= a welsh judge , & therefore let Ben proceede to be a barrister for John Boorne loyters . Y=r= prebendary Williams is a privie cou~saylor & not assuredly lord-keeper . We are sealinge of writings I $shall $be {TEXT:shalbe} ridde of Arkston only the little man~or of Meres Court stays in pawn with me for about $=l= {TEXT:300=l=} . Evry ma~ calls for money nobody pays .	god	help us . God blesse y=u= and all the childre~ . be assured I love y=u= . J. Hoskyns . 26 June 1621 . 	BODY	PRAYER	TRADE	OH INDIRECT	WRITER AND ADDRESSEE	HOSKYNS_022	E2	1621.0	AUTOGRAPH	FAMILY_NUCLEAR	JOHN_HOSKYNS_I	MALE	HUSBAND	1566	55	BENEDICTA_HOSKYNS[N.MOYLE]	FEMALE	WIFE	1575?	46?	HOSKYNS	1620	22.0	GOD
9879	32772	god	HOSKYNS_023	HOSKYNS_023.193_193	& is somewhat lyke her for stature & makinge . Com~end me to my daughter Margarett Boorne & tell her I hope she will thancke me for her . Let us all pray to god with thanksgevi~ge for the least of his benefitts & hu~ble supplicatio~ for his pardon for our synes . M=r= Edwards this bearer hath woundrously bound me to hym so hath Mr. Griffith lloyd who will come with us w=th= one ma~ only . I pray	god	we may be so happy as to have a coach & good horses meet us at Rosse upon fryday night . M=r= Edwards will tell you the rest . God keepe us all . Com~end me to all my Cosens Also I rest y=r= lovinge father-in-law J. Hoskyns . Risingto~ 11 Dec=r= 1627 . 	BODY	PRAYER	TRAVEL	OH INDIRECT	WRITER AND ADDRESSEE	HOSKYNS_023	E2	1627.0	AUTOGRAPH	FAMILY_NUCLEAR	JOHN_HOSKYNS_I	MALE	STEPFATHER	1566	61	ELIZABETH_BOURNE	FEMALE	STEPDAUGHTER	1601?	26?	HOSKYNS	1620	23.0	GOD
9914	20709	lord	BACON_112	BACON_112.122_122	monye which remaynythe of the pourchase of the londe we sold unto your honnore , and that the same maye be payd to my father with whome I have joynyd in acquytaunce for the holl as your honnore knowythe , who , I knowe , will carefullye bothe-7 for him selfe , me , my wiffe and children provide as nature bindythe him . Trustinge that for other respectes and promyses made unto us your honnore will stande our good	lorde	, and helpe us to some preferment for our better helpes , wherby we and ours $shall $be {TEXT:shalbe} bounde to praye for your honnore 's preservacione . Prayinge your honnore that my absence maye be no impedyment , for I was inforsyd for the helpe of my lyvinge to seke to serve in foren place as our Lorde knowythe , who sende youe longe liffe with honnore . This xii of December <font> anno </font> 1574 . 	BODY	CONFIDENCE	TRADE	0	0	BACON_112	E2	1574.0	AUTOGRAPH	OTHER	EDMUND_BANYARD	MALE	_	_	_	NICHOLAS_BACON_I	MALE	_	1510	64	BACON	1570	112.0	LORD
9930	32825	god	HUTTON_005	HUTTON_005.117_117	off November , I was putt in assured hoape off libertie , &c . Abowte thatt tyme arose a sudeyn contrarie tempest , which hadde browghte me to have appeared in the Starre Chamber 29 Novembris last , iff God had nott layed me up 2 dayes before off myne olde disease the stoane . By thatt occasion my apparence was respitted , and I now remayne as a man in suspense inter spem metumque , butt yett hoape that	God	wille in the ende turne all to the beste . I thanke ye for your manifold significations off your goode wille towarde me and myne . I praye <P_59> ye be goode to the bringer in that {in}_P ye maye lawfullye , commende me as ye knowe . God kepe you . 2 December , 1577 . Yours in Christe , E. C. To my lovinge frende , M=r=. Deane off Yorke . 	BODY	PRAYER	DISEASE	GOD	WRITER	HUTTON_005	E2	1577.0	AUTOGRAPH	FRIEND	EDMUND_GRINDALL	MALE	_	1519	58	MATTHEW_HUTTON_I	MALE	_	1529	48	HUTTON	1570	5.0	GOD
