	Column1	query	text_id	hit_id	left	hit	right	LABEL	AGENCY	DOMAIN	REAL_AGENCY	BENEFICIARY	letter_id	period	year_of_writing	authenticity	relation	author_name	author_gender	author_relation_to_recipient	author_year_of_birth	author_age	recip_name	recip_gender	recip_relation_to_addressee	recip_year_of_birth	recip_age	CORRESPONDENCE	DECADE	Kolom1	query_standardised
15309	22070	god	BARRING_129	BARRING.2855_2855	to my sister Lamplugh and the rest , sisters , brothers , freinds , children , I comitt us all to God and rest Your most dewtyfull and as loving sonn Thomas Barrington London , May 13 , 1631 I have sent yow papers from my nephew St Johns which are not to appeear allmost to any one . I beseich $you lett me crave them at my retourne , which shall be ere long , by the blessing of	God	. Barrington give $these 	BODY	DIVINE APPROVAL	TRAVEL	0	0	BARRING	E2	1631.0	AUTOGRAPH	FAMILY_OTHER_CODE_METADATA	JANE_HOOK[N.WHALLEY]	FEMALE	NIECE	_	_	JOAN_BARRINGTON	FEMALE	AUNT	1558?	73?	BARRING	1630		GOD
15336	68825	god	PASTON_338	PASTON.3112_3112	on in the tenauntes names of Cotton I sente as I wrote vn-to yow and my seruauntes there . Vp-on the sight of +te same lettre and billes John Russe with Geffrey Sperlyng riden to Cotton to fulfille parte , or as moche as +tei myght , of th'entente of +te same lettre touchyng +te first article , and as thei spedde +tere +tei writen , as I vnderstande , and sent vn-to yow from Cotton ; wherjnne I pray	God	spede yow , for me +tinkith the bille and the matier right good and weel spoken accordyng to the trouthe of +teire riotous demenyng . And also I receyvid the same tyme ano+ter bille in my name to be putte by whiche I like right weel , and thinke verily by all lyklynesse that +te bothe billes shall doo moche good , and grete pite` were but if +tei shuld be putte vp to th'entente +tere demenyng shuld be	BODY	PRAYER	TRADE	GOD	ADDRESSEE	PASTON	M4	1469.0	COPY	FAMILY_NUCLEAR_CODE_METADATA	MARGARET_PASTON[N.MAUTBY]	FEMALE	MOTHER	_	_	JOHN_PASTON_II	MALE	SON	1442	27	PASTON	1460		GOD
15349	22214	god	BARRING_137	BARRING.1626_1626	to be Your afectinat and obedient grantchild to comand Joan St John Harow the 9=o= of August , 1631 Hatfeild present thes Madam I have brought your daughter into Essex to waite upon you , but hearing that you are so full of greate company wee have forborne to come unto you untill wee heare that the coast is cleare . I have sent this bearer to see how you and my brother and sister doe , and purpose ,	God	willing , to bee with you this weeke if you bee not to <P_201> full of company . I doubt not but you have heard the good newes , but it may be you have not seene it , therfore I have sent you these bookes . So with remembrance of my servyce and duty , I rest Your dutifull sonne G. Gerard Otes , 25 August , 1631 at Hatfield these be given Good madam Had not this	BODY	DIVINE APPROVAL	TRAVEL	0	0	BARRING	E2	1631.0	AUTOGRAPH	FAMILY_OTHER_CODE_METADATA	JANE_HOOK[N.WHALLEY]	FEMALE	NIECE	_	_	JOAN_BARRINGTON	FEMALE	AUNT	1558?	73?	BARRING	1630		GOD
15407	22457	god	BARRING_144	BARRING.1104_1104	him to repaire the house , and you may send unto Higham to know what securitie he hath from the tenant for the paiment of the rent and reparations , but I suspect it may be there plott to cause the landlord to wright this letter unto you to see what they can gett from you . Madam , if in this or any thing other I may serve you I $will $be you send unto mee . I purpose	God	willing to be at London on Friday and at my nephew St John 's you shall heere of mee . God keepe you ever , Your dutifull sonne G. Gerard 13 Octobre , 1631 at Hatfield these be given My honored aunte My noble cosin Sir William Mewx was not a lytle glad to heere of your ladyship 's good healthe and his dawfter her hope of recoverie , and please God , as by the inclosed I conceive	BODY	DIVINE APPROVAL	TRAVEL	0	0	BARRING	E2	1631.0	AUTOGRAPH	FAMILY_OTHER_CODE_METADATA	JANE_HOOK[N.WHALLEY]	FEMALE	NIECE	_	_	JOAN_BARRINGTON	FEMALE	AUNT	1558?	73?	BARRING	1630		GOD
15408	72497	god	PASTON_349	PASTON.4502_4502	, which he promittyd vp a certeyn mony , &c. , and vndirtoke it , &c. , and fond that tyme no bonys in the matere , &c . And now he seyth he wil labowr and ryde and do hise part , &c . And he wold haf me to help hym , &c. , quod non fiet , &c. , or ell a man of credens of my maysterys , &c. , quod dubito fieri , &c .	God	bryng +gow sone hidyr , &c. , for I am weri tyl +ge come . Sire Thomas the parson , +gowr owne most trewe , &c. , be myn trewthe , and I +gowr bedeman and +gowrys at +gowr comaundment in +gowr letter , haf no more towchid of the mater , &c. , to my mayster , &c . Every day this v dayes he seyth , ' God send me sone my good cosyn Paston , for	BODY	PRAYER	TRADE	GOD	ADDRESSEE	PASTON	M4	1469.0	COPY	FAMILY_NUCLEAR_CODE_METADATA	MARGARET_PASTON[N.MAUTBY]	FEMALE	MOTHER	_	_	JOHN_PASTON_II	MALE	SON	1442	27	PASTON	1460		GOD
15425	73364	god	PASTON_399	PASTON.723_723	weder hadde seruyd theym , shuld a ben here sone vpon Candelmasse . At Trente <P_II,273> to London-wardes +tei shuld a ben by Candelmasse or sone after , on parte of theym , and another part comyng from Walys and the thredde from Yernessey and Garnesseye . Wher-fore it is weel don ye enforme myn Lord Warwyk , +tat he may speke to the Kyng +tat good provysion be hadde $in withstandyng there malicyous purpose and evyl wylle , whiche	God	graunt we may overcome theym ; and so we shuld , I dought not , if we were alle oon . There ben many $medelers , and they ben best cheryshed whiche wole hurt moche if the cas come to , as God diffende , &c . T. Howys 	BODY	PRAYER	WARFARE	OH INDIRECT	WRITER AND OH	PASTON	M4	1469.0	COPY	FAMILY_NUCLEAR_CODE_METADATA	MARGARET_PASTON[N.MAUTBY]	FEMALE	MOTHER	_	_	JOHN_PASTON_II	MALE	SON	1442	27	PASTON	1460		GOD
15433	73772	god	PASTON_412	PASTON.504_504	Frenshemen , and there tok of hem l , wherof xij shyppys were as gret as the <font> Grace de Dewe </font> ; and there is slayn on thys partyez the Lordys Clynton and Dakyr and many jentilmen , Ince and othyr , the <P_II,287> noumbre of iiij m=l= . And the seyd Spanyardys were purposyd with marchaundise in-to Flaundrez . My lordys of Warwykys shyp , the <font> Mary Grace </font> , and the fore they were formest .	God	send grace thys be trewe . On Thursday last past at London was no tydingys in serteyn where the flet was , nore what they had doon ; and therfore I fere the tydingys the more . Item , ser , as fore tydingys at London , there were arestyd be the Tresorer xl seylis lyeng in Temse , wherof many smale shyppis ; and it is seyd it is to carye men to Caleyse in all haste fore	BODY	PRAYER	WARFARE	GOD	WRITER	PASTON	M4	1469.0	COPY	FAMILY_NUCLEAR_CODE_METADATA	MARGARET_PASTON[N.MAUTBY]	FEMALE	MOTHER	_	_	JOHN_PASTON_II	MALE	SON	1442	27	PASTON	1460		GOD
15536	21724	lord	BARRING_100	BARRING_100.298_298	Lamplugh so ill in regard of bodily weakenesse , I hope the lord will in his good tyme gyve her the comfortes her soul desyres and bringe her with rejoyceing in his rich grac in Christ out of this sadnes ; my poore prayers and best indeavors dayly shall not be awanting for her good , but the care will requyre as well bodily as spirituall phisick , nyther alone $will $be {TEXT:wilbe} so avayleable as both together , the	lord	being pleased ( as my trust is he is ) to gyve a blessing . Mrs Lucy hath had a feavor , but is fynely recovored blessed be God ; it doth much cheare her when we speak of your ladiship 's comeing . She remebereth her duty and craves your blessing . Thus humbly and heartely beseecheing the lord dayly to adde unto your spirituall stock of grace and comfort and to recompenc your great and undeserved bounty	BODY	CONFIDENCE	DISEASE	0	0	BARRING_100	E2	1630.0	AUTOGRAPH	OTHER	JAMES_HARRISON	MALE	_	_	_	JOAN_BARRINGTON	FEMALE	_	1558?	72?	BARRING	1630	100.0	LORD
15563	80402	god	PASTON_462	PASTON.433_433	or to lefe thys letter at a barbourys house ovyr the seyd George to delyuer yt to Sir John Paston . </font> Plese your gode maistershyp to wete that I herd thys day how a man wend that a jugement ys passed ayenst your entent yn the ende of the last terme - yt was not of verray certeyn tolde me but as a dreme - yn the Kynges Chauncerye . I coude gefe none aunsuer thertoo . I pray	God	alle be well . Hyt wold ease som of your frendes hertys yff they coude vndrestond ony gode comfort . Sir , as for Robert I wold pray and requyre your maistershyp that he may for hys lernyng be abydyng wyth your cousyn of Lyncoln Inne , as yt vndre subieccion , wyth erly rysyng accustomed , for slouth ys the moder and noryssher of all vices . He hath cost me moch good and labour , and now	BODY	PRAYER	POLITICS	OH INDIRECT	ADDRESSEE	PASTON	M4	1469.0	COPY	FAMILY_NUCLEAR_CODE_METADATA	MARGARET_PASTON[N.MAUTBY]	FEMALE	MOTHER	_	_	JOHN_PASTON_II	MALE	SON	1442	27	PASTON	1460		GOD
15588	22529	god	BARRING_146	BARRING.1543_1543	to my daughter , of whoes recovery ( thancks be unto the author of all helth and good ) I perswade my self there is good hopes . My prayers shall not be wanting for the restoring her to perfect helth , and my endevors shall be to the uttermost to give her contentment . I intend to be with yow ( God willing ) about the feast of All Saints , when I shall express my self further by	God	's assistance . In the meane time I leave yow to the allmighty and rest yowr assured loving son William Meux Kingston the xx=th= of October , 1631 Concerning the business Sir Francis Harris hath propounded , I must take som time to consider . I am soe much bound unto yow for your many favor as that I know not how to make a sufficient acknowledgment . Hattfeilde give these Madame Yow see I have obayed your commaund	BODY	DIVINE APPROVAL	TRAVEL	0	0	BARRING	E2	1631.0	AUTOGRAPH	FAMILY_OTHER_CODE_METADATA	JANE_HOOK[N.WHALLEY]	FEMALE	NIECE	_	_	JOAN_BARRINGTON	FEMALE	AUNT	1558?	73?	BARRING	1630		GOD
15633	22862	god	BARRING_158	BARRING.3273_3273	for the privie tiethes . And truely madam I thinke ther is no man will geve more , nay scarce soe much . I am hartely glad he hath made so faire an offer , and if it please you good madam to accept of this ( as I hope you will ) I shall take a great deale of joy and comfort in it , and $will $be {TEXT:wilbe} very thankfull unto you for it whensoever it shall please	God	we meete againe . And I hope you shall herein doe your sonn a great good ( that if it please God he comes to enjoy it and live a neare neighbour ) ; it will be a great meanes to encrease and unite a great deale of love betwixt them , all which I hartely desire out of a reall affection , and it $shall $be {TEXT:shalbe} alwaies my sincere prayers unto almighty to blesse the same ,	BODY	DIVINE APPROVAL	MEETING	0	0	BARRING	E2	1631.0	AUTOGRAPH	FAMILY_OTHER_CODE_METADATA	JANE_HOOK[N.WHALLEY]	FEMALE	NIECE	_	_	JOAN_BARRINGTON	FEMALE	AUNT	1558?	73?	BARRING	1630		GOD
15639	84278	god	PASTON_515	PASTON.118_118	in +te grey mornyng iij men of my lord of Norffolk , as thei seide , with longe sperys haue take and led awey iij good hors fro John Poleyn , on of your fermores at Tichewell , and ledde hem a-wey , and haue bode hym come and trete with my lord of Norffolk . It is gret pete` +tat ther is non other ordenaunce . Thise pouere fermores are liche to be vndo ; wherfore atte vertu of	God	sende tidynges in hast what we shall do , for swiche an opyn wrong vnremedied knewe I never , ne good and trewe $men so vnkyndely vexed . And ye helpe not this matier I holde a man more +tan wood +tat wolde outher hold lond of yow or do for yow . Writen +te Saterday nexte after the Epiphanie . W. Cotyng TER_1470,_17_MAY}	BODY	PRAYER	SOCIAL	GOD	ADDRESSEE	PASTON	M4	1469.0	COPY	FAMILY_NUCLEAR_CODE_METADATA	MARGARET_PASTON[N.MAUTBY]	FEMALE	MOTHER	_	_	JOHN_PASTON_II	MALE	SON	1442	27	PASTON	1460	113.0	GOD
15645	84336	god	PASTON_114	PASTON_114.813_813	mony is not +get cownyd +tat I xuld send hym fore the sarsenet and damaske +tat I spake to hym foore . As fore the damaske , yt may be forebore tylle +te nexte terme , but as fore +te sarsenet , I woold haue yt and yt mythe be , fore I goo in my rentys . Late +gowr brothere see thys letter . As fore +gowr syster , I can send +gow no good tydynggys of here .	God	make here a good wooman . 	BODY	PRAYER	SOCIAL	OH DIRECT	OH	PASTON_114	M4	1470.0	COPY	FAMILY_NUCLEAR	MARGARET_PASTON[N.MAUTBY]	FEMALE	MOTHER	_	_	JOHN_PASTON_II	MALE	SON	1442	28	PASTON	1470	115.0	GOD
15647	23150	god	BARRING_175	BARRING.1031_1031	newes then I had from my honest sweet Charles who came to see me , I thanke him ; neither is thare any com over ( as yet ) more then my letters declared unto yow , only that your freinds in London are well , thankes be to God . Owr busines I have not yet entered into and therefor $can $not {TEXT:cannot} as yet any way account to yow for it . By the next I hope ,	God	willing , I shall be enabled to satisfye yow much better , meane while in greate hast , with my wife 's , my owne and sister 's dewtyes to yow , I comitt all to God and am ever Your most dewtyfull and loving sonn Thomas Barrington London , Holborne , Aprill 18 , 1632 I pray yow tell my neice Johan Gerard that I will remember her booke and commend me to my sisters , and I	BODY	DIVINE APPROVAL	COMMUNICATION	0	0	BARRING	E2	1631.0	AUTOGRAPH	FAMILY_OTHER_CODE_METADATA	JANE_HOOK[N.WHALLEY]	FEMALE	NIECE	_	_	JOAN_BARRINGTON	FEMALE	AUNT	1558?	73?	BARRING	1630		GOD
15687	84381	god	PASTON_134	PASTON_134.781_781	off Wynchester hathe take admynestracion off Syr J. Fastolffys testment and Syr William Yeluerton is excludyd . Syr William Yeluerton wotythe nat her-off , and I rek not thowe ye tell hym not ther-off . But thys ye may sey to Wylliam Yeluerton , whyche hathe by-foore thys tyme feynet that he ment well and wold that we hadd ben acordyd , that ye vndrestand that suche a tretye is hadd be-twen hym and me , and that ye preye	God	make an ende betwen vs , and than schall we all be goode felawez ageyn ; and that ye vndrestande +tat Heydon woll be a gret letter her-off , for he louythe nowthe Syr W. Yeluerton in conclusion , nor me nowther , and that he hathe a gret whyle lawhyd at vs bothe ; and iff we tweyn wer agreyd that nowthere of vsse bothe hathe no nede in tyme to kome to dele wyth hym , for	BODY	PRAYER	LEGAL	OH DIRECT	ADDRESSEE	PASTON_134	M4	1470.0	AUTOGRAPH	FAMILY_NUCLEAR	JOHN_PASTON_II	MALE	BROTHER	1442	28	JOHN_PASTON_III	MALE	BROTHER	1444	26	PASTON	1470	134.0	GOD
15738	84432	god	PASTON_160	PASTON_160.307_307	Gornay , Lomnore , and Skypwyth ; and I ame ryght gladde to se in yow suche kyndenesse on-to my brother as ye have doon to hym , and wolde by my trowthe levere than c li. +tat it weere fee symple londe , as it is entaylyd , whyche by liklyhood scholde prospere wyth hym and hyis blode the better in tyme to come and sholde also neuer cavse debate in owre bloode in tyme to come , whyche	Godde	dyffende for that weere onnaturell . Item , an other jnconvenyence is , wher as I vndrestande +tat the maner is gevyn to my brother and to hys wyff and to +te issywe bytwen them bygoten , iff the case weer soo +tat he and she hadde yssywe togedre a dowtre ore moo , and hys wyffe dyed and he maried afftre an othere and hadde issywe a sone , +tat sone sholde have noon londe , and he	BODY	PRAYER	SOCIAL	GOD	WRITER AND ADDRESSEE	PASTON_160	M4	1477.0	AUTOGRAPH	FAMILY_NUCLEAR	JOHN_PASTON_II	MALE	SON	1442	35	MARGARET_PASTON[N.MAUTBY]	FEMALE	MOTHER	_	_	PASTON	1470	160.0	GOD
15762	23645	god	BARRING_187	BARRING.3255_3255	but his army cutt in peices , and he is reported to be made the <P_247> generall of the Bavarian 's armye . The king of Sweden is sayed by som to have an inflamation in his legg caused by the heate of his bodye distempred by the verye ayre of the greate shott which killed his horss under him , but this is not yet assured . Letters are dayly expected , and then yow shall heear more ,	God	willing , meane while , the French king is assuredly gone to Loraine whare Mounsieur and the Duke of Loraine are ready of {COM:for_to?} meet him with a greate army , and Mounsieur le Force is by the king commaunded to beleaguer som of the duke 's tounes ; meane while , the ambassador com to owr king from Fraunce , Mourseiur St Choumont ( a greate man ) , hath now deleverd his message consisting of 3 perticulars	BODY	DIVINE APPROVAL	COMMUNICATION	0	0	BARRING	E2	1631.0	AUTOGRAPH	FAMILY_OTHER_CODE_METADATA	JANE_HOOK[N.WHALLEY]	FEMALE	NIECE	_	_	JOAN_BARRINGTON	FEMALE	AUNT	1558?	73?	BARRING	1630		GOD
15811	29637	god	FERRAR_012	FERRAR_012.127_127	and the Acknoaledgemente of y=r= Thankefulness I $can $not {TEXT:cannot} but Ioyfully receiue being soe much the greater proofes of y=r= Vertue by how much they are less due to myne - But what you giue mee before hande I shall Indeauor God willing to merritt heerafter by the full performance of that wherof you soe prize the beginning and Rude Draughte For such is all that hath yett passed in regarde of that which I purpose and hope by	Gods	grace to bee to you wards in the searche and study of true wisdom~ and perfection in Christ Iesus - Not as a Master but as a Partener and fellow studente w=th= you . Assuredly expecting to bee as much benifitted my selfe by the Example of your ready and zealous Practize as you hope to bee farthered by the meanes of my Constante Admonitions and Instructions To the submission and obedience wherof that you make soe faithfull promise	BODY	DIVINE APPROVAL	INTENTION	0	0	FERRAR_012	E2	1631.0	AUTOGRAPH	FAMILY_OTHER	NICHOLAS_FERRAR	MALE	UNCLE	1593	38	ANNA_COLLETT	FEMALE	NIECE	1603?	28?	FERRAR	1630	12.0	GOD
15835	84529	god	PASTON_192	PASTON_192.60_60	 Ryght worchepfull syr , I recomand me to yow , thankyng yow most hertly of your dylygence and cost whyche ye had in gettyng of the hawk whyche ye sent me , for well I wot your labore and trowbyll in that mater was as myche as thow she had ben the best of the world . But so	God	help me , as ferforthe as the most connyng estragers that euer I spak wyth can jmagyn , she shall neuer serue but to ley eggys , for she is bothe a mwer de haye and also she hathe ben so brooseid wyth cariage of fowle that she is as good as lame in boothe hyr leggys , as euery man may se at jee ; wherfor all syche folk as haue seen hyr auyse me to cast hyr	BODY	PRAYER	SOCIAL	GOD	WRITER	PASTON_192	M4	1472.0	AUTOGRAPH	FAMILY_NUCLEAR	JOHN_PASTON_III	MALE	BROTHER	1444	28	JOHN_PASTON_II	MALE	BROTHER	1442	30	PASTON	1470	192.0	GOD
15842	29678	god	FERRAR_017	FERRAR_017.205_205	& then Shee could neither expect comfort heere , nor hope for futuer happines - y=e= freedom~ from this feare yf it might bee shee sayd truly would more Ioy her then y=e= $assurance of a hundred pounds a yeares Inheritance , This Shee sayed was her owne mind - But yf it weare Gods will & her Parents & freinds desyres to whome Shee is bound to obey , in this & all others things Shee resolued & by	$Gods	grace would endeauour to submitt her owne will to giue Satisfaction to theres - w=th= this confidence y=t= it would proue in y=e= End euery way best for her - & this was her Conclusion - My deare Father By how much less this Passadge was Vnexpected by mee on y=e= Occasion , by soe much more am I perswaded in my owne mind to acquaynt y=u= therwith - Vpon Consideration thereof - not knowing what y=e= Consequence might	BODY	DIVINE APPROVAL	INTENTION	0	0	FERRAR_017	E2	1631.0	AUTOGRAPH	FAMILY_OTHER	MARY_COLLETT	FEMALE	NIECE	1601	30	NICHOLAS_FERRAR	MALE	UNCLE	1593	38	FERRAR	1630	17.0	GOD
15865	36298	god	OXINDE_034	OXINDE_034.131_131	send him unto me emptie handed , he told me your reason was because it would find a safer passage by the bearer hereof then by him ; but finding that he is returned likwise without soe much as an answere to my letter , I $can $not {TEXT:cannot} but wonder at it , and it doth imbolden me to be an earnest sutor unto you not to lett this bearer returne without his errant this second time , and	God	willing upon his nexte returne he shall bring you a bill of my former disbursings for your brother , who now is verie well , and if he neglect not the opportunitie which now is offered him , he $can $not {TEXT:cannot} desire nor I wish a more carefull man to reade unto him then now I have provided for him , and if you find any deficiencie in me any other way lett your penn show it and	BODY	DIVINE APPROVAL	TRAVEL	0	0	OXINDE_034	E2	1631.0	AUTOGRAPH	OTHER	FRANCIS_BLECHYNDEN	MALE	_	_	_	HENRY_OXINDEN[BARHAM]	MALE	_	1608	23	OXINDE	1630	35.0	GOD
15870	33710	god	KNYVETT_015	KNYVETT_015.382_382	the paiement of debts , & then shall Natt: be wholly at the mercye of Munn , whether he will Allowe him any thinge or no . Vpon this tickle pointe doe this stand . Natt: is much reservd to me & tells me nothing . We lye a great way a sunder , & what course he runns in this busines I knowe not , neither doe I thinke he knows what danger he is in , but (	God	willing ) the next oportunitye I have , I will breake the busines with him , & , if he will deale faierly with me , I doe the like with him , for I have gone as farr as I can in this discoverye without seing those writings w=ch= are in his hands . This $is all I can say of thus busines yet , And I praye keep this very secrett vntill you heer more from me	BODY	DIVINE APPROVAL	INTENTION	0	0	KNYVETT_015	E2	1632.0	AUTOGRAPH	FAMILY_NUCLEAR	THOMAS_KNYVETT	MALE	HUSBAND	1596	36	KATHERINE_KNYVETT	FEMALE	WIFE	_	_	KNYVETT	1630	15.0	GOD
15872	33714	god	KNYVETT_015	KNYVETT_015.868_868	thee all the newes that is in print . God of heaven Bless the & me & all ours ,. Amen . Commend me to my Brother Munn: & all the rest of yo=r= good companye . But not a word concerning Roane . Farwell . Thy true loving husband for ever Tho: Knyvett . St. Jones Novemb: 13. 1632 . I praye , if you can , send me some linkes or a good goose pye or both .	God	willing I $will $be {TEXT:wilbe} at home so soone as possible I can . at Ashwell Thorpe give these . 	BODY	DIVINE APPROVAL	TRAVEL	0	0	KNYVETT_015	E2	1632.0	AUTOGRAPH	FAMILY_NUCLEAR	THOMAS_KNYVETT	MALE	HUSBAND	1596	36	KATHERINE_KNYVETT	FEMALE	WIFE	_	_	KNYVETT	1630	16.0	GOD
15888	84582	god	PASTON_205	PASTON_205.452_452	ayen , axe hem non , but let hym comand theym to pay to no seruaunt of myn oncles , nor to hym-sylff nor to non othyr to hys vse , in peyne of payment a-yen to me . I thynk if ther shold be eny money axid in my name , parauenture it wold make my lady of Norffolk ayenst me and cause hyr to thynk I dellt more contrary to hyr plesure than dyd my brodyr , whom	God	pardon of hys gret mercy . I haue sent to entre at Stansted and at Orwellbery , and I haue wretyn a bylle to Anne Montgomery and Jane Rodon to mak my lady of Norffolk if it wyll be . Your sone and humble $seruaunt J. Paston If myn vnkynd oncle make eny mastryes to gadre money , areragys or other , my Mastyr Fytzwater , Syr Robart Wyngfeld , Syr Thomas $Brews , my brodyr Yeluerton , my	BODY	PRAYER	TRADE	GOD	OH	PASTON_205	M4	1479.0	AUTOGRAPH	FAMILY_NUCLEAR	JOHN_PASTON_III	MALE	SON	1444	35	MARGARET_PASTON[N.MAUTBY]	FEMALE	MOTHER	_	_	PASTON	1470	205.0	GOD
15896	84590	god	PASTON_209	PASTON_209.549_549	not , be Cryst calkestokke on hys hed ! +Tat is schoryle in Englyshe ; yt is a terme new browthe vp wyth my marschandys of Norwyche . Ser , John Pamppyng recummawnd hym to +gow , and pray +gow +tat +ge wyl remembyre hys harnes , and yf +tat +ge can get +te mony he pray +gow to delyuer Parkare x s. +tat he howyth hym . Also , ser , my modyre gretys +gow wel and send +gow	Goddys	blyssyng and heres , and prays +gow +tat +ge wyl bye here a runlet of malmesey owthe of +te galey ; and yf +ge haue no mony sche byd +tat +ge schuld borow of my brothere Ser John ore of sum othere frend of +gowers , and send $here woord as hastely as +ge haue yt and sche schale send +gow mony . And yf +tat +ge send yt home sche byd +tat yt schuld be woond in a	BODY	PRAYER	SOCIAL	GOD	ADDRESSEE	PASTON_209	M4	1471.0	AUTOGRAPH	FAMILY_NUCLEAR	EDMOND_PASTON_II	MALE	BROTHER	_	_	JOHN_PASTON_III	MALE	BROTHER	1444	27	PASTON	1470	209.0	GOD
15899	29709	god	FERRAR_022	FERRAR_022.336_336	be acomodated w=th= a convenient place for a while or longer yo~ will pleas to lett them com to Gidding I am very Confident they $will $be {TEXT:wilbe} rather promoters then Hinderers of any good yo~ see my Confidence & I hope will pardon me who w=th= tender of my due respect And humble prayers to God for y=u= shall euer rest yo=r= most bounden & faythfull Arth: Wodnoth for this weekes resolution be pleased to take this that by	$gods	grace I will nethere desyre nor keepe more of the things of this life then may rather further then Hinder me in to another 	BODY	DIVINE APPROVAL	RELIGION	0	0	FERRAR_022	E2	1633.0	AUTOGRAPH	FAMILY_OTHER	ARTHUR_WOODNOTH	MALE	COUSIN	1590?	43?	NICHOLAS_FERRAR	MALE	COUSIN	1593	40	FERRAR	1630	23.0	GOD
15907	29719	god	FERRAR_025	FERRAR_025.233_233	out that She would not lye noe more there in the other Chamber because it was Soe vndecent that Fellowes and Wenches Came at Such howers in as {at}_P they did That it was alsoe to Coold for her and that she was almost lamed ; I prayed her to lett me know what was the Causes and what greived her in any kind and according to the promise I had Soe often in writing made her I would by	gods	grace give her all Content but of this thing I never heard the least dislike before but praid her to haue more patience and thies things should noe more trouble her For I would Instantly make it warmer w=th= Curtaynes as I did and there should noe body Come hereafter to Call mee a Morning . And what Ever yeat there was that troubled her in this or in any other thing lett her give me notise of it	BODY	DIVINE APPROVAL	0	0	0	FERRAR_025	E2	1633.0	AUTOGRAPH	FAMILY_NUCLEAR	JOHN_FERRAR_SR	MALE	BROTHER	1590	43	NICHOLAS_FERRAR	MALE	BROTHER	1593	40	FERRAR	1630	25.0	GOD
